{
    "configuracion": {
        "ancho": 40,
        "alto": 25
    },
    "hitos": {},
    "conexiones": [],
    "agentesspawn": [
        [
            5.5,
            14.0
        ],
        [
            6.0,
            8.5
        ],
        [
            19.5,
            8.0
        ],
        [
            20.5,
            14.5
        ],
        [
            31.5,
            15.0
        ]
    ],
    "muros": [
        {
            "id": "Muro_1",
            "tipo": "muro_exterior",
            "poligono": [
                [
                    -0.5,
                    -0.3
                ],
                [
                    -0.5,
                    -0.7
                ],
                [
                    39.5,
                    -0.7
                ],
                [
                    39.5,
                    -0.3
                ]
            ],
            "directriz": {
                "x1": -0.5,
                "y1": -0.5,
                "x2": 39.5,
                "y2": -0.5
            }
        },
        {
            "id": "Muro_2",
            "tipo": "muro_exterior",
            "poligono": [
                [
                    39.3,
                    -0.5
                ],
                [
                    39.7,
                    -0.5
                ],
                [
                    39.7,
                    24.5
                ],
                [
                    39.3,
                    24.5
                ]
            ],
            "directriz": {
                "x1": 39.5,
                "y1": -0.5,
                "x2": 39.5,
                "y2": 24.5
            }
        },
        {
            "id": "Muro_3",
            "tipo": "muro_exterior",
            "poligono": [
                [
                    39.5,
                    24.3
                ],
                [
                    39.5,
                    24.7
                ],
                [
                    -0.5,
                    24.7
                ],
                [
                    -0.5,
                    24.3
                ]
            ],
            "directriz": {
                "x1": -0.5,
                "y1": 24.5,
                "x2": 39.5,
                "y2": 24.5
            }
        },
        {
            "id": "Muro_4",
            "tipo": "muro_exterior",
            "poligono": [
                [
                    -0.3,
                    24.5
                ],
                [
                    -0.7,
                    24.5
                ],
                [
                    -0.7,
                    -0.5
                ],
                [
                    -0.3,
                    -0.5
                ]
            ],
            "directriz": {
                "x1": -0.5,
                "y1": -0.5,
                "x2": -0.5,
                "y2": 24.5
            }
        },
        {
            "id": "Muro_5",
            "tipo": "muro_interior",
            "poligono": [
                [
                    -0.5,
                    4.075
                ],
                [
                    -0.5,
                    3.925
                ],
                [
                    11.0,
                    3.925
                ],
                [
                    11.0,
                    4.075
                ]
            ],
            "directriz": {
                "x1": -0.5,
                "y1": 4.0,
                "x2": 11.0,
                "y2": 4.0
            }
        },
        {
            "id": "Muro_6",
            "tipo": "muro_interior",
            "poligono": [
                [
                    11.075,
                    4.0
                ],
                [
                    10.925,
                    4.0
                ],
                [
                    10.925,
                    -0.5
                ],
                [
                    11.075,
                    -0.5
                ]
            ],
            "directriz": {
                "x1": 11.0,
                "y1": -0.5,
                "x2": 11.0,
                "y2": 4.0
            }
        },
        {
            "id": "Muro_7",
            "tipo": "muro_interior",
            "poligono": [
                [
                    10.925,
                    4.5
                ],
                [
                    11.075,
                    4.5
                ],
                [
                    11.075,
                    24.5
                ],
                [
                    10.925,
                    24.5
                ]
            ],
            "directriz": {
                "x1": 11.0,
                "y1": 4.5,
                "x2": 11.0,
                "y2": 24.5
            }
        },
        {
            "id": "Muro_8",
            "tipo": "muro_interior",
            "poligono": [
                [
                    11.0,
                    24.575
                ],
                [
                    11.0,
                    24.425
                ],
                [
                    11.5,
                    24.425
                ],
                [
                    11.5,
                    24.575
                ]
            ],
            "directriz": {
                "x1": 11.0,
                "y1": 24.5,
                "x2": 11.5,
                "y2": 24.5
            }
        },
        {
            "id": "Muro_10",
            "tipo": "muro_interior",
            "poligono": [
                [
                    11.0,
                    4.075
                ],
                [
                    11.0,
                    3.925
                ],
                [
                    39.5,
                    3.925
                ],
                [
                    39.5,
                    4.075
                ]
            ],
            "directriz": {
                "x1": 11.0,
                "y1": 4.0,
                "x2": 39.5,
                "y2": 4.0
            }
        },
        {
            "id": "Muro_11",
            "tipo": "muro_interior",
            "poligono": [
                [
                    11.075,
                    4.5
                ],
                [
                    10.925,
                    4.5
                ],
                [
                    10.925,
                    4.0
                ],
                [
                    11.075,
                    4.0
                ]
            ],
            "directriz": {
                "x1": 11.0,
                "y1": 4.0,
                "x2": 11.0,
                "y2": 4.5
            }
        },
        {
            "id": "Muro_12",
            "tipo": "muro_interior",
            "poligono": [
                [
                    23.425,
                    4.0
                ],
                [
                    23.575,
                    4.0
                ],
                [
                    23.575,
                    24.5
                ],
                [
                    23.425,
                    24.5
                ]
            ],
            "directriz": {
                "x1": 23.5,
                "y1": 4.0,
                "x2": 23.5,
                "y2": 24.5
            }
        },
        {
            "id": "Muro_13",
            "tipo": "muro_interior",
            "poligono": [
                [
                    23.5,
                    24.425
                ],
                [
                    23.5,
                    24.575
                ],
                [
                    23.0,
                    24.575
                ],
                [
                    23.0,
                    24.425
                ]
            ],
            "directriz": {
                "x1": 23.0,
                "y1": 24.5,
                "x2": 23.5,
                "y2": 24.5
            }
        },
        {
            "id": "Muro_14",
            "tipo": "muro_interior",
            "poligono": [
                [
                    23.0,
                    24.425
                ],
                [
                    23.0,
                    24.575
                ],
                [
                    22.0,
                    24.575
                ],
                [
                    22.0,
                    24.425
                ]
            ],
            "directriz": {
                "x1": 22.0,
                "y1": 24.5,
                "x2": 23.0,
                "y2": 24.5
            }
        }
    ]
}